{
  "format": "ilal-zk-issuer-pilot-evidence-v1",
  "status": "COMPLETE",
  "chainId": 84532,
  "roles": {
    "deployer": "0x1b869CaC69Df23Ad9D727932496AEb3605538c8D",
    "issuer": "0xC61d6115fcFcbA97Bd44Cb013C877bD0ef868dB3",
    "settlementAssetOperator": "0xF40493ACDd33cC4a841fCD69577A66218381C2fC",
    "liquidityProvider": "0xc0807D4778a9E5FE15ad68A8500e64d65BA78D58",
    "institutionA": "0x58B24A10593a50a83E9F74bB1Ff3F98421288797",
    "institutionB": "0x359C370fC666A01216895ddD050eeE5E86702990",
    "executor": "0x304d3F240e4dCE9Fd47f23AbAedd1cdc117bE3d3"
  },
  "assets": {
    "issuerStablecoin": {
      "name": "Issuer ZK Pilot Stablecoin",
      "symbol": "zkUSD",
      "decimals": 6,
      "role": "issuer-stablecoin",
      "address": "0x666093b5248Bed47e7A72A4569FC18d3A9DEc918",
      "controller": "0xC61d6115fcFcbA97Bd44Cb013C877bD0ef868dB3"
    },
    "settlementCash": {
      "name": "USDC-like Sandbox Settlement Cash",
      "symbol": "sUSDC",
      "decimals": 6,
      "role": "sandbox-settlement-cash",
      "address": "0x3a54C18982e6EE52197De17185583324A39b192A",
      "controller": "0xF40493ACDd33cC4a841fCD69577A66218381C2fC"
    }
  },
  "deployment": {
    "$schema": "../schema/deployment-manifest.schema.json",
    "schemaVersion": 1,
    "format": "ilal-mixed-deployment-v1",
    "version": "1.0.0-issuer-pilot-testnet.3",
    "status": "candidate",
    "network": "base-sepolia",
    "chainId": 84532,
    "protocolVersion": 3,
    "classification": "testnet",
    "ceremony": "unsafe-development",
    "sourceCommit": "38231796a2a96d7b32c4046312a9e74eaf319cdd",
    "releaseCommit": null,
    "sourceRevision": "38231796a2a96d7b32c4046312a9e74eaf319cdd",
    "sourceDigest": "65ccdf0d876c8d6998bc1c2bcda0d66d33a4859334adbd003e81d14f5174e45b",
    "sourceTreeHash": "0x65ccdf0d876c8d6998bc1c2bcda0d66d33a4859334adbd003e81d14f5174e45b",
    "sourceDirty": false,
    "deployer": "0x1b869CaC69Df23Ad9D727932496AEb3605538c8D",
    "admin": "0xC61d6115fcFcbA97Bd44Cb013C877bD0ef868dB3",
    "treasury": null,
    "adminTreasuryShared": false,
    "contracts": {
      "poolManager": "0x05E73354cFDd6745C338b50BcFDfA3Aa6fA03408",
      "hook": "0xCeF2f9636DAf1f18d9198bd75a9832e98CE24AA8",
      "executionRouter": "0xbFda50B01b286BCecabb40fc9B5B2bB8fd1493F4",
      "liquidityRouter": "0x6eC5b3BDF242e1eEB78F88D65963632C1120afF0",
      "oracle": "0xf6D00CD71a5834CD738059e77D0DaD9caBcf6157",
      "grantManager": "0x3Ef189FF8B9Cbf7D19976be50bb326D130106793",
      "policyRegistry": "0x76BE077344056cD1aBAb3c17Db89423C17318D7B"
    },
    "pool": {
      "currency0": "0x3a54C18982e6EE52197De17185583324A39b192A",
      "currency1": "0x666093b5248Bed47e7A72A4569FC18d3A9DEc918",
      "fee": 500,
      "tickSpacing": 10,
      "hooks": "0xCeF2f9636DAf1f18d9198bd75a9832e98CE24AA8",
      "poolId": "0xd5f7895e627cdf3b5224693a94d9ba00b7b4f2bf1b222d3e7308977605805266",
      "initializationTransactionHash": "0x40f3044ddc8b6a21f3bd4dd71b91209b423e48a84265b41da68e4b3916865c9b",
      "initializationBlockNumber": 47436766,
      "key": {
        "currency0": "0x3a54C18982e6EE52197De17185583324A39b192A",
        "currency1": "0x666093b5248Bed47e7A72A4569FC18d3A9DEc918",
        "fee": 500,
        "tickSpacing": 10,
        "hook": "0xCeF2f9636DAf1f18d9198bd75a9832e98CE24AA8"
      }
    },
    "codeHashes": {
      "poolManager": "0x03c45db6d09b14da7c1f7239a5a49697f976d395277e6d2acb6fbed3f9e0249f",
      "hook": "0x7e3f37e5e362f119c2a51ce2e201fac4809dbf25b319c03b96d00a3e5441cef2",
      "executionRouter": "0x6e8aa21b2f2a51512b3d2c7d977bc9e0d6191a735a90d9a495667d1067a86874",
      "liquidityRouter": "0x25daba4806a2b746ee68bb8410c92e578fb327912708a10420ddb8c2fa77c2d5",
      "oracle": "0x6df2f77431b0bae907ad2ae0dacb0368be6724e5da56ce8553d6157507accf66",
      "grantManager": "0xbd2a0c2926c4641a2df978e4c47b448a29429d3fe8cae605d1ee654fc48894ff",
      "policyRegistry": "0x5dd8cc22299f2abc95eb6166a149dc2013f20e6811b818f78de7ade04f0ee0a4"
    },
    "infrastructure": {
      "referenceGuard": "0x121FB0Ed870B58905B2eE2A7BAbbff7F800f189D",
      "factory": "0x3710d80A035ad4B4668894Ce02A91a311980940a",
      "verifierAdapter": "0xaa204E50309e41d33f60D7d23D070B796AeF7330"
    },
    "toolchain": {
      "solc": "0.8.26+commit.8a97fa7a",
      "optimizerEnabled": true,
      "optimizerRuns": 200,
      "viaIR": false,
      "evmVersion": "cancun",
      "remappings": [
        "v4-core/=lib/v4-core/",
        "v4-periphery/=lib/v4-periphery/",
        "@uniswap/v4-core/=lib/v4-core/",
        "permit2/=lib/v4-periphery/lib/permit2/",
        "@openzeppelin/=lib/openzeppelin-contracts/",
        "forge-std/=lib/forge-std/src/"
      ],
      "libraries": {}
    },
    "privilegedRoles": [
      {
        "capability": "issuer pilot policy administrator",
        "applicable": true,
        "contract": "0x76BE077344056cD1aBAb3c17Db89423C17318D7B",
        "holder": "0xC61d6115fcFcbA97Bd44Cb013C877bD0ef868dB3",
        "verificationCall": "owner()",
        "result": "issuer controls the ZK_ONLY pool policy",
        "deployerRetained": false
      },
      {
        "capability": "issuer stablecoin controller",
        "applicable": true,
        "contract": "0x666093b5248Bed47e7A72A4569FC18d3A9DEc918",
        "holder": "0xC61d6115fcFcbA97Bd44Cb013C877bD0ef868dB3",
        "verificationCall": "owner()",
        "result": "testnet sandbox issuance only",
        "deployerRetained": false
      },
      {
        "capability": "settlement cash controller",
        "applicable": true,
        "contract": "0x3a54C18982e6EE52197De17185583324A39b192A",
        "holder": "0xF40493ACDd33cC4a841fCD69577A66218381C2fC",
        "verificationCall": "owner()",
        "result": "separate testnet sandbox cash issuance",
        "deployerRetained": false
      },
      {
        "capability": "Hook CREATE2 factory owner",
        "applicable": true,
        "contract": "0x3710d80A035ad4B4668894Ce02A91a311980940a",
        "holder": "0x1b869CaC69Df23Ad9D727932496AEb3605538c8D",
        "verificationCall": "owner()",
        "result": "testnet PoC only; cannot modify the deployed Hook",
        "deployerRetained": true
      }
    ],
    "pilot": {
      "roles": {
        "deployer": "0x1b869CaC69Df23Ad9D727932496AEb3605538c8D",
        "issuer": "0xC61d6115fcFcbA97Bd44Cb013C877bD0ef868dB3",
        "settlementAssetOperator": "0xF40493ACDd33cC4a841fCD69577A66218381C2fC",
        "liquidityProvider": "0xc0807D4778a9E5FE15ad68A8500e64d65BA78D58",
        "institutionA": "0x58B24A10593a50a83E9F74bB1Ff3F98421288797",
        "institutionB": "0x359C370fC666A01216895ddD050eeE5E86702990",
        "executor": "0x304d3F240e4dCE9Fd47f23AbAedd1cdc117bE3d3"
      },
      "assets": {
        "issuerStablecoin": {
          "name": "Issuer ZK Pilot Stablecoin",
          "symbol": "zkUSD",
          "decimals": 6,
          "role": "issuer-stablecoin",
          "address": "0x666093b5248Bed47e7A72A4569FC18d3A9DEc918",
          "controller": "0xC61d6115fcFcbA97Bd44Cb013C877bD0ef868dB3"
        },
        "settlementCash": {
          "name": "USDC-like Sandbox Settlement Cash",
          "symbol": "sUSDC",
          "decimals": 6,
          "role": "sandbox-settlement-cash",
          "address": "0x3a54C18982e6EE52197De17185583324A39b192A",
          "controller": "0xF40493ACDd33cC4a841fCD69577A66218381C2fC"
        }
      },
      "cnfIssuer": null,
      "policy": {
        "mode": "ZK_ONLY",
        "grantTtlSeconds": 3600,
        "issuerHash": "16573840488812875028019693213617520977614861514605894108491375000805978903736",
        "schemaHash": "14515775511358287391421496088316323779570165726936020040789386394950245060090",
        "acceptedRoot": "15402393281401022116591794878202541844657315035404385409622565537835991097154",
        "jurisdictionRoot": "7736161102292762061292386413892580673328182200372958848548456859964895873995",
        "zkPolicyHash": "6829511415085700601041486013145959488876895564996061819191138470411746627612",
        "minKycLevel": 2
      },
      "scenario": {
        "issuerAssetInput": "100000000",
        "settlementCashInput": "70000000",
        "tickLower": -1000,
        "tickUpper": 1000,
        "liquidityDelta": "100000000000000"
      }
    },
    "operationalEvidence": {
      "status": "not completed",
      "reason": "Deployment alone does not prove funded grants, liquidity, execution, root retirement or LP exit."
    },
    "configurationDigest": "e3620027d4228bd07d05e4462c413a5cd58c8ff66c8cf90e5db0b228afbb81ef",
    "transactions": [
      {
        "label": "Deploy issuer-controlled Asset A",
        "nonce": 1665,
        "transactionHash": "0x0a236124d63f91e680f11556c02d7ee5e3bf16d0be9e1c56cbf8cf01386c0cf2",
        "blockNumber": "47436735",
        "blockHash": "0xa54bcac160bb9f85c7f2040a92d4f3a71ffa29bcb2545e5c1fce4bb89b9b973b",
        "contractAddress": "0x666093b5248bed47e7a72a4569fc18d3a9dec918",
        "gasUsed": "603538"
      },
      {
        "label": "Deploy sandbox settlement Asset B",
        "nonce": 1666,
        "transactionHash": "0xe46c70e903be400c38194768e7730f8a487a300ae0b7649e8fb2c27b85687c2a",
        "blockNumber": "47436737",
        "blockHash": "0xfc637429c6d5d91a6709e166ee8152d3fbe198c52d5f91240ccb82d6c909c7b3",
        "contractAddress": "0x3a54c18982e6ee52197de17185583324a39b192a",
        "gasUsed": "648139"
      },
      {
        "label": "Deploy ChainlinkStablecoinOracleGuard",
        "nonce": 1667,
        "transactionHash": "0x798870e556541d92d08ea1c5f398d9e116e6f54e7af4a58db85f402e62876518",
        "blockNumber": "47436739",
        "blockHash": "0xc7d291ffb3d0631f42ff7da8c6f121db15d6b4e71bed8796d90f4cffe6dcf503",
        "contractAddress": "0x121fb0ed870b58905b2ee2a7babbff7f800f189d",
        "gasUsed": "717816"
      },
      {
        "label": "Deploy MixedOracleGuard",
        "nonce": 1668,